<?xml version="1.0" encoding="UTF-8"?>

<schema xmlns="http://www.w3.org/2001/XMLSchema"
        targetNamespace="http://www.dreamtravel.by/vouchers"
        xmlns:tns="http://www.dreamtravel.by/vouchers"
        elementFormDefault="qualified">
    <element name="vouchers">
        <complexType>
            <sequence>
                <element name="voucher" type="tns:voucher" minOccurs="2" maxOccurs="unbounded"/>
            </sequence>
        </complexType>
    </element>
    <complexType name="voucher">
        <sequence>
            <element name="typeOfVoucher" type="tns:typeOfVoucher"/>
            <element name="country" type="string"/>
            <element name="city" type="string"/>
            <element name="numberDays" type="positiveInteger"/>
            <element name="numberNights" type="positiveInteger"/>
            <element name="transport" type="string"/>
            <element name="hotelCharacteristic" type="tns:hotelCharacteristic"/>
           </sequence>
        <attribute name="id" type="tns:voucher" use="required" />
        <attribute name="voucher"  use="optional" default="false"/>
            </complexType>
    <simpleType name="id">
        <restriction base="ID">
            <pattern value="p\d{1,4}"/>
        </restriction>
    </simpleType>

    <simpleType name="typeOfVoucher">
            <restriction base="string">
                <enumeration value="Weekend pass"/>
                <enumeration value="Tour"/>
                <enumeration value="Holidays"/>
         </restriction>
        </simpleType>

      <simpleType name="country">
        <restriction base="string">
            <enumeration value="Russia"/>
            <enumeration value="Belarus"/>
            <enumeration value="Switzerland"/>
            <enumeration value="Egypt"/>
        </restriction>
    </simpleType>

    <simpleType name="city">
        <restriction base="string">
            <enumeration value="Moscow"/>
            <enumeration value="Saint-Petersburg"/>
            <enumeration value="Minsk-Belovezhskaya Pushcha-Minsk"/>
            <enumeration value="Zurich"/>
            <enumeration value="Sharm-El-Sheikh"/>
        </restriction>
    </simpleType>

    <simpleType name="numberDays">
        <restriction base="positiveInteger">
            <minInclusive value="1"/>
            <maxExclusive value="30"/>
        </restriction>
    </simpleType>

    <simpleType name="numberNights">
        <restriction base="positiveInteger">
            <minInclusive value="1"/>
            <maxExclusive value="30"/>
        </restriction>
    </simpleType>


    <complexType name="hotelCharacteristic">
           <sequence>
               <element name="hotelStars" type="positiveInteger"/>
               <element name="hotelFood" type="string"/>
               <element name="hotelRoom" type="string"/>
               <element name="tv" type="string"/>
               <element name="airConditioner" type="string"/>
           </sequence>
       </complexType>

    <simpleType name="hotelStars">
    <restriction base="positiveInteger">
        <minInclusive value="1"/>
        <maxExclusive value="5"/>
            </restriction>
        </simpleType>

    <simpleType name="hotelFood">
        <restriction base="string">
            <enumeration value="AO"/>
            <enumeration value="CB"/>
            <enumeration value="BB"/>
            <enumeration value="HB"/>
            <enumeration value="FB"/>
            <enumeration value="FB+"/>
            <enumeration value="AI"/>
        </restriction>
    </simpleType>

    <simpleType name="hotelRoom">
        <restriction base="string">
            <enumeration value="single"/>
            <enumeration value="double"/>
            <enumeration value="triple"/>
                  </restriction>

    </simpleType>
    <simpleType name="tv">
        <restriction base="string">
            <enumeration value="yes"/>
            <enumeration value="no"/>
            </restriction>

    </simpleType>
    <simpleType name="airConditioner">
        <restriction base="string">
            <enumeration value="yes"/>
            <enumeration value="no"/>
        </restriction>
    </simpleType>
</schema>