<?xml version="1.0" encoding="UTF-8"?>
<vouchers xmlns:xsi="http://www.w3.org/2001/XMLSchema-instance"
        xmlns="http://www.dreamtravel.by/vouchers"
        xsi:schemaLocation="http://www.dreamtravel.by/vouchers vouchers.xsd">

<voucher id="w01">
    <typeOfVoucher>Weekend pass</typeOfVoucher>
        <country>Russia</country>
        <city>Moscow</city>
        <departure>2022-03-09</departure>
        <numberDays>2</numberDays>
        <numberNights>1</numberNights>
        <transport>bus</transport>
        <hotelCharacteristic>
            <hotelStars>4</hotelStars>
            <hotelFood>NO</hotelFood>
            <hotelRoom>single</hotelRoom>
            <tv>yes</tv>
            <airConditioner>yes</airConditioner>
        </hotelCharacteristic>
</voucher>

<voucher id="w02" >
            <typeOfVoucher>Weekend pass</typeOfVoucher>
            <country>Russia</country>
            <city>Saint-Petersburg</city>
            <departure>2022-04-03</departure>
            <numberDays>3</numberDays>
            <numberNights>2</numberNights>
            <transport>bus</transport>
            <hotelCharacteristic>
                <hotelStars>5</hotelStars>
                <hotelFood>FB</hotelFood>
                <hotelRoom>double</hotelRoom>
                <tv>yes</tv>
                <airConditioner>yes</airConditioner>
            </hotelCharacteristic>
</voucher>

<voucher id="t03" >
        <typeOfVoucher>Tour</typeOfVoucher>
        <country>Belarus</country>
        <city>Minsk-Belovezhskaya Pushcha-Minsk</city>
        <departure>2022-04-28</departure>
        <numberDays>2</numberDays>
        <numberNights>1</numberNights>
        <transport>bus</transport>
        <hotelCharacteristic>
            <hotelStars>4</hotelStars>
            <hotelFood>BB</hotelFood>
            <hotelRoom>double</hotelRoom>
            <tv>yes</tv>
            <airConditioner>no</airConditioner>
        </hotelCharacteristic>
</voucher>

<voucher id="h04">
    <typeOfVoucher>Holidays</typeOfVoucher>
        <country>Switzerland</country>
        <city>Zurich</city>
        <departure>2022-04-17</departure>
        <numberDays>7</numberDays>
        <numberNights>6</numberNights>
        <transport>airplane</transport>
         <hotelCharacteristic>
            <hotelStars>5</hotelStars>
            <hotelFood>AI</hotelFood>
            <hotelRoom>double</hotelRoom>
            <tv>yes</tv>
            <airConditioner>yes</airConditioner>
        </hotelCharacteristic>
</voucher>

<voucher id="h05" >
    <typeOfVoucher>Holidays</typeOfVoucher>
        <country>Egypt</country>
        <city>Sharm-El-Sheikh</city>
        <departure>2022-04-25</departure>
        <numberDays>10</numberDays>
        <numberNights>9</numberNights>
        <transport>airplane</transport>
        <hotelCharacteristic>
            <hotelStars>5</hotelStars>
            <hotelFood>AI</hotelFood>
            <hotelRoom>triple</hotelRoom>
            <tv>yes</tv>
            <airConditioner>yes</airConditioner>
        </hotelCharacteristic>
    </voucher>
</vouchers>